{
  "schema_version": "vacua.mcp.storage-tree-page.v1",
  "generation_id": "stg_sample_20260930_abc123",
  "parent_node": {
    "node_id": "stn_00000000000000000000000000000001",
    "display_name": "Projects",
    "display_path": "/Users/alice/Projects",
    "kind": "root",
    "depth": 0,
    "direct_logical_bytes": 0,
    "direct_allocated_bytes": 0,
    "subtree_logical_bytes": 62100000000,
    "subtree_allocated_bytes": 48200000000,
    "file_count": 17355,
    "directory_count": 315,
    "hardlink_alias_count": 12,
    "is_hardlink_alias": false,
    "child_count": 4,
    "mtime_sec": 1727683200
  },
  "metric": "allocated",
  "items": [
    {
      "node_id": "stn_00000000000000000000000000000002",
      "parent_id": "stn_00000000000000000000000000000001",
      "display_name": "node_modules",
      "display_path": "/Users/alice/Projects/node_modules",
      "kind": "directory",
      "depth": 1,
      "direct_logical_bytes": 0,
      "direct_allocated_bytes": 0,
      "subtree_logical_bytes": 24000000000,
      "subtree_allocated_bytes": 18400000000,
      "file_count": 14203,
      "directory_count": 250,
      "hardlink_alias_count": 0,
      "is_hardlink_alias": false,
      "child_count": 120,
      "mtime_sec": 1727683200
    },
    {
      "node_id": "stn_00000000000000000000000000000003",
      "parent_id": "stn_00000000000000000000000000000001",
      "display_name": "build",
      "display_path": "/Users/alice/Projects/build",
      "kind": "directory",
      "depth": 1,
      "direct_logical_bytes": 0,
      "direct_allocated_bytes": 0,
      "subtree_logical_bytes": 15000000000,
      "subtree_allocated_bytes": 11700000000,
      "file_count": 3110,
      "directory_count": 50,
      "hardlink_alias_count": 0,
      "is_hardlink_alias": false,
      "child_count": 30,
      "mtime_sec": 1727683200
    },
    {
      "node_id": "stn_00000000000000000000000000000004",
      "parent_id": "stn_00000000000000000000000000000001",
      "display_name": "datasets",
      "display_path": "/Users/alice/Projects/datasets",
      "kind": "directory",
      "depth": 1,
      "direct_logical_bytes": 0,
      "direct_allocated_bytes": 0,
      "subtree_logical_bytes": 12000000000,
      "subtree_allocated_bytes": 9100000000,
      "file_count": 42,
      "directory_count": 5,
      "hardlink_alias_count": 0,
      "is_hardlink_alias": false,
      "child_count": 10,
      "mtime_sec": 1727683200
    }
  ],
  "total_child_count": 4,
  "limit": 3,
  "offset": 0,
  "remainder": {
    "item_count": 1,
    "logical_bytes": 11100000000,
    "allocated_bytes": 9000000000
  },
  "next_cursor": "cur_stg_sample_20260930_abc123_stn01_3"
}
